sample_id,source,gid,text,word_len,char_len,eval_5gram_overlap,text_hash
d_gutenberg_0217,gutenberg_poetry_corpus,23972,"Weeks gone, still they're sitting, Milly, Billy;
O, the winter winds are wondrous chilly!
""Winter weather,
Close together;
Wouldn't tarry,
Better marry.
Don't wait, 'twon't do,
Knockety-nick, nickety-knock,""--
Goes the kitchen clock.
Winters two have gone, and where is Milly?
Spring has come again, and where is Billy?
""Give me credit,",53,336,0.0,854f457fa399e16c
d_gutenberg_0218,gutenberg_poetry_corpus,8187,"Dreaming of music he slumbered the while
Till faint from his lip a soft melody broke,
And Venus, enchanted, looked on with a smile,
While Love to his own sweet singing awoke.
Then sing--sing--Music was given,
To brighten the gay, and kindle the loving;
Souls here, like planets in Heaven,
By harmony's laws alone are kept moving.
Tho' humble the banquet to which I invite thee,
Thou'lt find there the best a poor bard can command:",78,430,0.0,998d3744f84d79d8
d_gutenberg_0219,gutenberg_poetry_corpus,579,"You's mightily in de grass.
De Meth'dis team's done hitched; O fool,
De day's a-breakin' fas';
Gear up dat lean ole Baptis' mule,
Dey's mightily in de grass, grass,
Dey's mightily in de grass.
De workmen's few an' mons'rous slow,
De cotton's sheddin' fas';
Whoop, look, jes' look at de Baptis' row,",53,298,0.0,f93a5f27d18add25
d_gutenberg_0220,gutenberg_poetry_corpus,6268,"Thy sweetness scatters sweetness everywhere,
O flower of all!
O flower of all the years, O flower of all,
A day beside thee is a day of days;
Thy voice is softer than the throstle's call,
There is not song enough to sing thy praise,
O flower of all!
O flower of all the years, O flower of all,
I seek thee in thy garden, and I dare
To love thee; and though my deserts be small,
Thou art the only flower I would wear,",85,416,0.0,530c2415534b54a8
d_gutenberg_0221,gutenberg_poetry_corpus,703,"(Kept in'ts traduction pure) dost thou inherit,
That, not contented with one single fame,
Dost to a double glory spread thy name,
And on thy happy temples safely set
Both th' Delphick wreath and civic coronet?
Was't not enough for us to know how far",45,249,0.0,69ae9245c4638e11
d_gutenberg_0222,gutenberg_poetry_corpus,1852,"Let this day upon one final victory set,
And complete a life's conquest!""
He said, ""Understand!
If Constance wed the son of this man, by whose hand
My heart hath been robb'd, she is lost to my life!
Can her home be my home?  Can I claim in the wife
Of that man's son the child of my age?  At her side",62,300,0.0,7324eb14e03ecc5d
d_gutenberg_0223,gutenberg_poetry_corpus,6520,"But would you guess that it was the tiny shadow of your little
child?
When in the evening you went to the cow-shed with the lighted
lamp in your hand, I should suddenly drop on to the earth again
and be your own baby once more, and beg you to tell me a story.
""Where have you been, you naughty child?""
""I won't tell you, mother.""  That's what you and I would say
then.
cfairy.jpg]
If people came to know where my king's palace is, it would vanish
The walls are of white silver and the roof of shining gold.
The queen lives in a palace with seven courtyards, and she wears
But let me tell you, mother, in a whisper, where my king's palace",127,637,0.0,a39c15b3cce258ba
d_gutenberg_0224,gutenberg_poetry_corpus,1953,"Of things and thoughts even now thou art my next;
Sole neighbour, and no space between, thou art--
And yet art drawing nearer, nearer still.
Therefore, my brothers, therefore, sisters dear,
However I, troubled or selfish, fail
In tenderness, or grace, or service clear,
I every moment draw to you more near;
God in us from our hearts veil after veil
Keeps lifting, till we see with his own sight,",70,396,0.0,6a0825dda865c893
d_gutenberg_0225,gutenberg_poetry_corpus,26864,"Nor yet by blindly groping.
All the world's a stage you know
The men and women actors;
A little joy, a little woe--
These are but human factors.
The mellow days still come and go,
The earth is full of beauty;
If we would only think it so,
Life is not all a duty.
And you are young in heart not years,
Is this not true because
You mingle happiness with tears
And do not look for flaws?
Your silver hair is but the snow",85,417,0.0,5ab8af3b966aa7ed
d_gutenberg_0226,gutenberg_poetry_corpus,962,"She seeks of Thee that boon, that gift sublime,
The Christian radiance, for this hope of Time!
And Thou wilt listen! and Thy face will bend
To smile upon us--Master, Father, Friend!
The Christ to whom pure pleading heart hath crept
Was human once, and in the darkness wept;
The gracious love that helped us long ago
Will on us like a summer sunrise flow,
And be a light to guide the nation's feet
On holy paths--on sacred ways and sweet.
Ah, the bitter, hopeless desert!  Here these broken human wrecks
Trod the wilds where sand of fire is with the spiteful spinifex,
One man yielded--then another--then a lad of nineteen years
Reeled and fell, with English rivers singing softly in his ears,",127,692,0.0,2c064dffbb895c74
d_gutenberg_0227,gutenberg_poetry_corpus,1333,"Water the grave where hope lies slain.
For tears are like a summer rain,
To murmur in a mourner's ears,
To soften all the field of fears,
To moisten valleys parched with pain.
And though thy tears will not awake
What lies beneath of young or fair
And sleeps so sound it draws no breath,",55,286,0.0,5ae0d289986080a9
d_gutenberg_0228,gutenberg_poetry_corpus,24530,"Rush, like a furry elf
Tumbling over himself.
How does he sleep? He winks
Twice with his mischief eyes;
Dozes a bit; then lies
Down with a sigh; then thinks
Over some roguish play,
And is up and away!",39,200,0.0,6c7e55a525590baf
d_gutenberg_0229,gutenberg_poetry_corpus,6795,"Those pleasant spas--our reigning passion--
Where learned Dons meet folks of fashion;
Where--each with each illustrious soul
Familiar as in Charon's boat,
All sorts of fame sit cheek-by-jowl,
Pearls in that string--the table d'hote!
Where dames whom man has injured--fly,
To heal their wounds or to efface, them;
While others, with the waters, try
A course of flirting,--just to brace them!
Well, there (O man, how light thy woes",76,429,0.0,70f4b75b5b091299
d_gutenberg_0230,gutenberg_poetry_corpus,1719,"On smashed and struggling spears.
Cast down from some unconquered town
That, rushing earthward, carries down
Loads of live men of all renown--
Archers and engineers.
And a great clamour of Christian men
Went up in agony,
Crying, ""Fallen is the tower of Wessex",44,259,0.0,2cfb3894454a4b18
d_gutenberg_0231,gutenberg_poetry_corpus,38503,"quamquam multa manus ad caeli caerula templa
tendebam lacrumans et blanda uoce uocabam.
uix aegro cum corde meo me somnus reliquit.'
CVRANTES magna cum cura tum cupientes
regni dant operam simul auspicio augurioque.
... Remus auspicio se deuouet atque secundam
solus auem seruat. at Romulus pulcher in alto
quaerit Auentino, seruat genus altiuolantum.
certabant urbem Romam Remoramne uocarent.
omnibus cura uiris uter esset induperator.
expectant, ueluti consul cum mittere signum
uolt omnes auidi spectant ad carceris oras,",77,524,0.0,ef4d86a38b07b718
d_gutenberg_0232,gutenberg_poetry_corpus,36149,"Blew music from the stops of watery stems,
And swept the grasses with her viewless robes,
Which dreaming men thought voices, dreaming still.
Now as I lay in vision by the stream
That flows amidst our well beloved vale,
I looked throughout the vista stretched between
Two ranging hills; one meadowed rich in grass;
The other wooded, thick and quite obscure",61,355,0.0,419fc8ad19549d07
d_gutenberg_0233,gutenberg_poetry_corpus,39909,"No trees, but his topmasts, to yield him a shade:
Then, add to the list of the mariner's evils,
The water corrupted, the bread full of weevils,
Salt junk to be eat, be it better or worse,
And, often bull beef of an Irishman's horse:
Whosoever is free, he must still be a slave,
(Despotic is always the rule on the wave;)
Not relished on water, your lords of the main
Abhor the republican doctrines of Paine,
And each, like the despot of Prussia, may say",86,453,0.0,65e5a62ae33e014f
d_gutenberg_0234,gutenberg_poetry_corpus,6652,"And I will STOP HIM on his restless way;
Omnipotent in love's resistless might,
Last night, as o'er the page of love's despair,
My Delia bent DELICIOUSLY to grieve,
I stood a TREACHEROUS LOITERER by her chair,
And drew the FATAL SCISSORS from my sleeve:
And would at that instant o'er my thread
The SHEARS OF ATROPOS had opened then;
And when I reft the lock from Delia's head,
Had cut me sudden from the sons of men!",78,417,0.0,d6af35469d23fa4f
d_gutenberg_0235,gutenberg_poetry_corpus,2622,"Had I but plenty of money, money enough and to spare,
The house for me, no doubt, were a house in the city-square.
Ah, such a life, such a life, as one leads at the window there!
Something to see, by Bacchus, something to hear, at least!
There, the whole day long, one's life is a perfect feast;
Well now, look at our villa! stuck like the horn of a bull
Just on a mountain-edge as bare as the creature's skull,
Save a mere shag of a bush with hardly a leaf to pull!
--I scratch my own, sometimes, to see if the hair's turned wool.
But the city, oh the city--the square with the houses!  Why?",120,592,0.0,daf920c88058c12b
d_gutenberg_0236,gutenberg_poetry_corpus,12413,"How light our feet were: with what rhythmic strides
We left the long blue gulf behind us, sown
Far out with snowy sails; and how our hearts
Rose with the growth of morning, till we reached
That moss-hung fountain on the hillside near
Cleonæ, where the dark anemones
Cover the ground, and make it red like fire.
Could ever grief, I wonder, or fixed care,
Or even the lingering twilight of old age,
Divest for me such memories of their sweet?",82,440,0.0,fe0c3ce8b026ff2b
d_gutenberg_0237,gutenberg_poetry_corpus,38520,"And, nursed by day and night, by sun and shower,
Doth momently to fresher beauty rise:
To us the leafless autumn is not bare,
Nor winter's rattling boughs lack lusty green.
Our summer hearts make summer's fulness, where
No leaf, or bud, or blossom may be seen:
For nature's life in love's deep life doth lie,",56,308,0.0,2d89851790ca3af0
d_gutenberg_0238,gutenberg_poetry_corpus,1030,"We had religion, but of late
That's beaten down with clubs;
Whilst that profaneness authorized
Is belched forth in tubs.
We were free subjects born, but now
We are by force made slaves,
By some whom we did count our friends,
But in the end proved knaves.",47,254,0.0,64833266b2c57cf2
d_gutenberg_0239,gutenberg_poetry_corpus,32528,"Emmanuel succeeds; his dream of the rivers Ganges and Indus
The king consults his council
Entrusts the expedition to Vasco de Gama
Vasco de Gama's preparations
Parting of the armada with their friends
The old man's farewell address
Departure of the fleet from Lisbon
The river Senegal, Cape Verde, San Jago, Jalofo, Mandinga
St. Thomas, Congo, the river Zaire
A water-spout described
They land near the Tropic of Capricorn
A native African met with",75,448,0.0,5a23531484dcb4aa
d_gutenberg_0240,gutenberg_poetry_corpus,30332,"Because no base man things like this may see,
And live thereafter long and happily.""
""Lady,"" he said, ""in Florence is my home,
And in my city noble is my name;
Neither on peddling voyage am I come,
But, like my fathers, bent to gather fame;
And though thy face has set my heart a-flame
Yet of thy story nothing do I know,",64,321,0.0,085bd5828fcad247
d_gutenberg_0241,gutenberg_poetry_corpus,31184,"They smote your body on its bier,
For surety that you could not speak.
A hero in the desert died;
Men cried that saints should bury him.
And round the grave should guard and ride,
A chivalry of Cherubim.
God said: ""There is a better place,
A nobler trophy and more tall;
The beasts that fled before his face
Shall come to make his funeral.
""The mighty vermin of the void
That hid them from his bended bow,
Shall crawl from caverns overjoyed,",83,441,0.0,186d45cd75bd3470
d_gutenberg_0242,gutenberg_poetry_corpus,42299,"He look'd his thanks, then squeez'd my hand,
Bade me, what gold could pay, command;
Of all I wish'd to take my fill,
Enjoy myself, nor fear the bill.
I took my patient at his word,
And what the _Blue Bell_ could afford,
(An Inn of good repute and worth,",50,253,0.0,ecc64cb59a7033d1
d_gutenberg_0243,gutenberg_poetry_corpus,1057,"There never does that dreary north-wind blow
Which leaves our English forests bleak and bare,
Nor ever falls the swift white-feathered snow,
Nor ever doth the red-toothed lightning dare
To wake them in the silver-fretted night
When we lie weeping for some sweet sad sin, some dead delight.
Alas! they know the far Lethaean spring,
The violet-hidden waters well they know,
Where one whose feet with tired wandering",73,413,0.0,fca6e7f9397317f5
d_gutenberg_0244,gutenberg_poetry_corpus,32528,"Their rapid footsteps scarcely touch the ground;
Through copse, through brake, impatient of their prey,
Swift as the wounded deer, they spring away:
Fleet through the winding shades, in rapid flight,
The nymphs, as wing'd with terror, fly their sight;
Fleet though they fled, the mild reverted eye
And dimpling smile their seeming fear deny.
Fleet through the shades in parted rout they glide:
If winding path the chosen pairs divide,
Another path by sweet mistake betrays,
And throws the lover on the lover's gaze:",85,515,0.0,47f9ce32ccaa3adb
d_gutenberg_0245,gutenberg_poetry_corpus,36150,"Whatever fate befell me;
She put her arms about my neck
And soothed the pain of leaving,
And, though her heart was like to break,
She spoke no word of grieving;
She let no tear bedim her eye,
For fear _that_ might distress me,
But, kissing me, she said good-by",51,260,0.0,0d839513ae207b76
d_gutenberg_0246,gutenberg_poetry_corpus,1279,"How prodigal of time!
Mis-spending all thy precious hours--
Thy glorious, youthful prime!
Alternate follies take the sway;
Licentious passions burn;
Which tenfold force gives Nature's law.
That man was made to mourn.
""Look not alone on youthful prime,
Or manhood's active might;
Man then is useful to his kind,",51,310,0.0,ccf01d2970ced382
d_gutenberg_0247,gutenberg_poetry_corpus,6652,"Your unsophisticated impulses,
Taught ye to soar above their ""settled rules
Of Vice and Virtue."" Fairest creature! He
Whom the world called thy husband, was in truth
Unworthy of thee.-A dull plodding wretch!
With whose ignoble nature thy free spirit
Held no communion.--'T was well done, fair creature!
T' assert the independence of a mind
Created-generated I would say--
Free as ""that chartered libertine, the air.""
Joy to thy chosen partner! blest exchange!
Work of mysterious sympathy I that drew",83,499,0.0,0cb397efcb3492c0
d_gutenberg_0248,gutenberg_poetry_corpus,42439,"In the skies.
See, my love, the shadows creeping,
Round my bed while I am sleeping,
List! I hear a sound of weeping!
Now it dies.
Raise me up, the day is breaking;
Streaks of gray proclaim its waking;
Sleep my weary eyes forsaking,
In the light.
Raise me up that I may, nearer,",54,277,0.0,9d53bc4a027d357d
d_gutenberg_0249,gutenberg_poetry_corpus,1544,"Age is full of care;
Youth like summer morn,
Age like winter weather;
Youth like summer brave,
Age like winter bare;
Youth is full of sport,
Age's breath is short;
Youth is nimble, age is lame;
Youth is hot and bold,",41,216,0.0,ee709a43e345a78b
d_gutenberg_0250,gutenberg_poetry_corpus,26036,"Hath come to seek the lore deep laid
Up here in Harvard Square.""
""It matters not how you implore,
He can no longer stay;
But on the night's 'Plutonian shore,'
Await the coming day.
I'm sorry, sir,"" he calmly said,
""Though hard, I guess 'tis fair,
Thou hast no place to lay thy head--",55,283,0.0,b4072e28ddaee2a4
d_gutenberg_0251,gutenberg_poetry_corpus,6652,"Scared by his Lady's heart-appalling cry,
Vanished at once poor Mason's golden dream--
For dream it was;--and all his visions high,
Of wealth and grandeur, fled before that scream--
And still he listens, with averted eye,
When gibing neighbors make ""the Ghost"" their theme
While ever from that hour they all declare
That Mrs. Mason used a cushion in her chair!
Gengulphus comes from the Holy Land,
With his scrip, and his bottle, and sandal shoon;",78,447,0.0,5351f544e06be284
d_gutenberg_0252,gutenberg_poetry_corpus,35991,"A garden of old urns and ancient growths,
Some flowering plants around the wall.
And in the garden's center stood a statue,
With outstretched arms, the Virgin without the child.
And suddenly on Elenor Murray came
Great sorrow like a madness, seeing there
The pitying Virgin, stretching arms to her.
And so she ran along the pebbly walk,
Fell fainting at the Virgin's feet and lay
Unconscious in the garden.
When she woke
Two nuns were standing by, and one was dressed
In purest white, and held within her hands
A tray of gold, and on the tray of gold",100,550,0.0,2c3ac2d92e733f0b
d_gutenberg_0253,gutenberg_poetry_corpus,6375,"Record his name 'midst Hordes unknown,
Unknowing what it told.
To thee, perhaps, the fates may give--
I wish they may--in health to live,
Herds, flocks, and fruitful fields,
Thy vacant hours in mirth to shine;
With these, the muse already thine
Her present bounties yields.
For me, O Shore! I only claim
To merit, not to seek for fame,
The good and just to please,
A state above the fear of want,
Domestic love, Heaven's choicest grant,
Health, leisure, peace, and ease.",84,470,0.0,8091b15d10cb0ce8
d_gutenberg_0254,gutenberg_poetry_corpus,8930,"And we're cursing his staff for incompetent swine.
""He's a cheery old card,"" grunted Harry to Jack
As they slogged up to Arras with rifle and pack.
But he did for them both by his plan of attack.
I found him in the guard-room at the Base.
From the blind darkness I had heard his crying
And blundered in. With puzzled, patient face
A sergeant watched him; it was no good trying
To stop it; for he howled and beat his chest.",83,422,0.0,f3a1a828a42d82cf
d_gutenberg_0255,gutenberg_poetry_corpus,400,"To bar the joy we may not win,
Peace would go out forevermore
If we should dare to enter in.
Within the tiny Pantheon
We stood together silently,
Leaving the restless crowd awhile
As ships find shelter from the sea.
The ancient centuries came back
To cover us a moment's space,
And thro' the dome the light was glad
Because it shone upon your face.",65,348,0.0,bbabb22f173839d5
d_gutenberg_0256,gutenberg_poetry_corpus,25953,"You were lying on the bath-boards,
On the bench your head reclining.
""When the room again you enter,
Then announce the bath is ready:
'O my father-in-law beloved,
Now the bath is fully ready:",37,191,0.0,db205bcd23571083
d_gutenberg_0257,gutenberg_poetry_corpus,2151,"The trivialest point, or you may lose your labor!
And yet there is in this no Gordian knot
Which one might not undo without a sabre,
If one could merely comprehend the plot.
Enwritten upon the leaf where now are peering
Eyes scintillating soul, there lie _perdus_
Three eloquent words oft uttered in the hearing
Of poets, by poets--as the name is a poet's, too.
Its letters, although naturally lying
Like the knight Pinto--Mendez Ferdinando--
Still form a synonym for Truth--Cease trying!",85,488,0.0,1f0821fd641e7115
d_gutenberg_0258,gutenberg_poetry_corpus,27441,"Men, women, girls, and boys,
Sighing and sobbing, came to his lodging,
And made a hideous noise.
O save us all, More of More-hall,
Thou peerless knight of these woods;
Do but slay this dragon, who won't leave us a rag on,
We'll give thee all our goods.
This being done, he did engage
To hew the dragon down;
But first he went new armour to
Bespeak at Sheffield town;
With spikes all about, not within but without,
Of steel so sharp and strong,
Both behind and before, arms, legs, and all o'er,",94,493,0.0,ab3c95402925cf61
d_gutenberg_0259,gutenberg_poetry_corpus,39909,"Their squadrons, arm'd with gun and sword,
Their legions, led by knight and lord
Have sworn to see the reign restored
Of George, the goth;
Whose mandate, from a vandal shore,
Impels the sail, directs the oar,
And, to extend the flames of war,
Employs them both.
""To clear the lake of Perry's fleet
And make his flag his winding sheet
This is my object--I repeat--""
--Said Barclay, flush'd with native pride,
To some who serve the british crown:--
But they, who dwell beyond the moon,",87,483,0.0,ddefed39503be2ef
d_gutenberg_0260,gutenberg_poetry_corpus,38438,"And with all its soundless, purple trumpets,
Lo, the Joe-Pyeweed still blows to me!
Slight as thou art, thou art enough to hide
Like all created things, secrets from me,
And stand a barrier to eternity.
And I, how can I praise thee well and wide
From where I dwell--upon the hither side?
Thou little veil for so great mystery,
When shall I penetrate all things and thee,
And then look back? For this I must abide,
Till thou shalt grow and fold and be unfurled
Literally between me and the world.
Then I shall drink from in beneath a spring,",103,540,0.0,801ad98e80b396eb
d_gutenberg_0261,gutenberg_poetry_corpus,38549,"Sicknesse would have gladly been
Sick himselfe to have sav'd him;
And his feaver wish'd to prove,
Burning onely in his love.
Him when Wrath it selfe had seen,
Wrath it selfe had lost his spleen.
Grim Destruction here amaz'd,
In stead of striking, would have gaz'd.
Even the iron-pointed pen,
That notes the tragick doomes of men,
Wet with teares, 'still'd from the eyes
Of the flinty Destinies,
Would have learn't a softer style,",76,429,0.0,1b424e1f56d1094d
d_gutenberg_0262,gutenberg_poetry_corpus,615,"Sinned against chastity, in word or deed:
But him with impious visage and severe
The paynim scared, ill pleased the truth to read.
So that, through fear, he further speech forbore,
But changed not therefore aught his former lore.
Having stopt further question in this wise,
The paynim monarch from the table rose:
Then lays him on his bed, till from the skies
The dusky shades depart, and morning glows:
But spends a larger part of night in sighs",79,446,0.0,eeada0d6aa16b538
d_gutenberg_0263,gutenberg_poetry_corpus,6652,"Nor notice give at all.
The firemen terrified are slow
To bid the pumping torrent flow,
For fear the roof would fall.
Back, Robins, back; Crump, stand aloof!
Whitford, keep near the walls!
Huggins, regard your own behoof,
For lo! the blazing rocking roof
Down, down, in thunder falls!
An awful pause succeeds the stroke,
And o'er the ruins volumed smoke,
Rolling around its pitchy shroud,
Concealed them from th' astonished crowd.
At length the mist awhile was cleared,",79,469,0.0,2979c1d605197c4f
d_gutenberg_0264,gutenberg_poetry_corpus,42181,"How can he quit the world of mental bliss,
For all the riches,--miseries!--of this?
When to the region of the tuneful Nine,
Rapt in poetic vision, I retire,
Listening intent to catch the strain divine--
What a dead silence hangs upon the lyre!
Lo! with disorder'd locks, and streaming eyes,
Stray the fair daughters of immortal song;
Aonia's realm resounds their plaintive cries,
And all her murmuring rills the grief prolong.
O say! celestial maids, what cause of wo?
Why cease the rapture-breathing strains to soar?
A solemn pause ensues:--then falters low
The voice of sorrow: 'Chatterton's no more!'",104,603,0.0,86e08fd795204f1e
d_gutenberg_0265,gutenberg_poetry_corpus,30494,"A favorite play-place was the orchard, where grew the biggest
""Please, might we? We will be so good!""
To make mother ""unhappy"" was the worst rebuke possible to these
flower-garden, then in the fowl-yard.
""Hadn't you better you go and see after him?""
cherry-tree.
""Very well. Obey your mother. I'll just run up the tree myself.""
market-basket.
""We were to eat as many as we liked, only we must first fill the",77,407,0.0,9f43b8a5ba6ab3af
d_gutenberg_0266,gutenberg_poetry_corpus,32091,"And Sam sighs, ""Bless 'ee, Ma'am, keep the other,
There's nowt that I want now I have my Mother.""
But the Fairy laughs softly, and says, says she,
""There's one wish left, Sam, I promised 'ee three.
Hasten your wits, the hour creeps on,
There's calling afield and I'm soon to be gone.",53,283,0.0,2cc494da2d6f2b9e
d_gutenberg_0267,gutenberg_poetry_corpus,6619,"Wergeland's statue on May seventeenth
Saw the procession. And as its rear-guard,
Slow marching masses,
Strong men, and women with flower-decked presence;
Come now the peasants, come now the peasants.
Österdal's forest's magnificent chieftain
Bore the old banner. Soon as we see it
Blood-red uplifted,
Greet it the thousands in thought of its story:",57,348,0.0,1e3ca3f379fb7ae0
d_gutenberg_0268,gutenberg_poetry_corpus,29722,"On the face of De Clifford, with fury flushed,--
And forth on the Palmer he wildly rushed!--
""False Hubert!"" he cried; and his knightly sword
Was sheathed in the heart of the fiend-sold lord!--
With a scream of terror, Gertrude fell--
For she knew the pride of Sir Raymond well!
He flew to raise her--but 'twas in vain:",60,319,0.0,1f703071ad4cd002
d_gutenberg_0269,gutenberg_poetry_corpus,42553,"_Pr._ The Fates three-formed, and the remembering Furies.
_Ch._ Than these, then, is Zeus weaker?
_Pr._ Ay, he could not escape what has been fated.
_Ch._ But what to Zeus is fated, except always to rule?
_Pr._ This thou wilt not learn; seek not to know.
_Ch._ Surely some awful thing it is which you withhold.
_Pr._ Remember other words, for this by no means",66,359,0.0,7c6ff04011a2d9d5
d_gutenberg_0270,gutenberg_poetry_corpus,41810,"Corred más paso;
Que se duerme mi niño,
Tened los ramos.
El niño divino,
Que está cansado
De llorar en la tierra,
Por su descanso
Sosegar quiere un poco
Del tierno llanto;
Que se duerme mi niño,
Tened los ramos.",44,211,0.0,f8a0becc55f904c4
d_gutenberg_0271,gutenberg_poetry_corpus,36803,"Gazing in sadness at the lion's head,
Ugly and massive, coarse, yet noble, too,
Transfigured by the power shining through,
The steadfast purpose, the unflinching will,
Decisive, swift to save alive, or kill,
As was required. Aye, and more was there;
The tenderness, the pity, all the care",48,288,0.0,c290f5a3b7b7b76b
