sample_id,source,gid,text,word_len,char_len,eval_5gram_overlap,text_hash
d_gutenberg_0001,gutenberg_poetry_corpus,3650,"And prayer upon the cross.
The wrong that pains my soul below
I dare not throne above:
I know not of His hate,--I know
His goodness and His love.
I dimly guess from blessings known
Of greater out of sight,
And, with the chastened Psalmist, own
His judgments too are right.
I long for household voices gone,
For vanished smiles I long,
But God bath led my dear ones on,",71,368,0.0,e934ed38cd59ffbe
d_gutenberg_0002,gutenberg_poetry_corpus,39784,"You find milk and I'll find flour,
And we'll have a pudding in half an hour.
who shot at a frog.]
who had a great dog.]
all covered with lace.]
who played with a grace.]
with pride on his brow.]",40,194,0.0,65f2f03a92692312
d_gutenberg_0003,gutenberg_poetry_corpus,23665,"The sunbeam was clear on that lovely retreat;
The breath of the morning was balmy and sweet;
Fair _flowrets_, that vied with the rainbow, were seen,
And _trees_ in their livery of liveliest green.
The voice of rejoicing, from children of earth,
Was so mingled with cheerfulness, music, and mirth,
That the mind, and the eye, and the ear, and the heart
Were saluted with pleasure from every part.
A thousand gay faces appear'd in the throng,
And crowds of fair creatures came trooping along.",85,490,0.0,300858593fb71697
d_gutenberg_0004,gutenberg_poetry_corpus,6130,"And Oloosson’s chalky cliffs arise.
Sprung from Pirithous of immortal race,
The fruit of fair Hippodame’s embrace,
(That day, when hurl’d from Pelion’s cloudy head,
To distant dens the shaggy Centaurs fled)
With Polypoetes join’d in equal sway
Leonteus leads, and forty ships obey.
In twenty sail the bold Perrhaebians came
From Cyphus, Guneus was their leader’s name.
With these the Enians join’d, and those who freeze
Where cold Dodona lifts her holy trees;
Or where the pleasing Titaresius glides,
And into Peneus rolls his easy tides;
Yet o’er the silvery surface pure they flow,",95,583,0.0,ecb369f7018fb079
d_gutenberg_0005,gutenberg_poetry_corpus,35848,"And as with spear and hunters' frock
They bore him to the tomb,
The Blackguard Bell i' the old town clock
Began untouched to boom.
'Rouse there! rouse out of the house, there!
Hey, landlord! help us, Heaven!
Can no one get a drop of wine
By night at half-past 'leven?'
But those 'tis known who die of thirst",61,307,0.0,2172701bc0c4ba00
d_gutenberg_0006,gutenberg_poetry_corpus,34237,"Shall feel an overseeing power
To kindle or restrain.
""She shall be sportive as the fawn
That, wild with glee, across the lawn,
Or up the mountain springs;
And hers shall be the breathing balm,
And hers the silence and the calm
Of mute, insensate things.
""The floating clouds their state shall lend",53,298,0.0,b3fbc4bca61a1882
d_gutenberg_0007,gutenberg_poetry_corpus,37510,"An' t'ink dat all de Canaya
Will tremble in his breech--
An' lick de hole dem crew--
Go, tak' Quebec an' Hottawa,
An' Lac Megantic too.""
I jomp on top ma moccasin,
An' dance aroun' de floor;",37,190,0.0,4b2b6bf16f2c04d6
d_gutenberg_0008,gutenberg_poetry_corpus,34237,"Come, let us go, while we are in our prime,
And take the harmless folly of the time!
We shall grow old apace, and die
Before we know our liberty.
Our life is short, and our days run
As fast away as does the sun.",45,211,0.0,01f21d7ba8d1f3ef
d_gutenberg_0009,gutenberg_poetry_corpus,1279,"Wi' fright that day.
Hear how he clears the point o' faith
Wi' rattlin and wi' thumpin!
Now meekly calm, now wild in wrath,
He's stampin, an' he's jumpin!
His lengthen'd chin, his turned-up snout,
His eldritch squeel an' gestures,
O how they fire the heart devout,
Like cantharidian plaisters
On sic a day!
But hark! the tent has chang'd its voice,
There's peace an' rest nae langer;
For a' the real judges rise,
They canna sit for anger,",80,438,0.0,1d9565c0d8aecbd8
d_gutenberg_0010,gutenberg_poetry_corpus,29358,"Or with the dart or eager shaft a better prize may gain,
Or whoso hath the heart to play in fight-glove of raw hide,
Let all be there, and victory's palm and guerdon due abide.
His mother's bush he did on brow e'en as the word he said;
The like did Helymus, the like Acestes ripe of eld,
The like the boy Ascanius, yea, and all that manner held.
Then from that council to the tomb that duke of men did pass;
Mid many thousands, he the heart of all that concourse was.
There, worshipping, on earth he pours in such wise as was good
Two cups of mere wine, two of milk, and two of holy blood,
And scatters purple flowers around; and then such words he said:
""Hail, holy father! hail once more! hail, ashes visited",139,710,0.0,e17925d6c2404894
d_gutenberg_0011,gutenberg_poetry_corpus,8784,"I mark'd how he did point with menacing look
At thee, and heard him by the others nam'd
Geri of Bello.  Thou so wholly then
Wert busied with his spirit, who once rul'd
The towers of Hautefort, that thou lookedst not
That way, ere he was gone.""--""O guide belov'd!
His violent death yet unaveng'd,"" said I,
""By any, who are partners in his shame,
Made him contemptuous: therefore, as I think,
He pass'd me speechless by; and doing so
Hath made me more compassionate his fate.""
So we discours'd to where the rock first show'd",96,522,0.0,334ca4d97a79a99a
d_gutenberg_0012,gutenberg_poetry_corpus,1006,"Thus hath one Guido from the other snatch'd
The letter'd prize: and he perhaps is born,
Who shall drive either from their nest.  The noise
Of worldly fame is but a blast of wind,
That blows from divers points, and shifts its name
Shifting the point it blows from.  Shalt thou more
Live in the mouths of mankind, if thy flesh
Part shrivel'd from thee, than if thou hadst died,
Before the coral and the pap were left,
Or ere some thousand years have passed? and that",87,464,0.0,8532fad285758b61
d_gutenberg_0013,gutenberg_poetry_corpus,262,"Was no thought else that mattered,
And nothing else was true,
But the white fire of moonlight,
And a white dream of you.
""Oh! Love,"" they said, ""is King of Kings,
And Triumph is his crown.
Earth fades in flame before his wings,",43,227,0.0,b245591cc04ada8c
d_gutenberg_0014,gutenberg_poetry_corpus,42299,"A dealer of great retail fame,        }
You have our leave to do the same.'   }
""I made my bow and answer'd nought,
But then I paid it off in thought;
And, as their gen'rous leave they give,
Like others to play tricks and live,
I may begin, perhaps, before
My name is painted on the door;
And, in good time, my fortune try
With that same prosp'ring honesty.
--I tell you, MOLLY, 'tis as clear
As we, dear girl, are sitting here,
That our great folks were both created
So rich, please fortune, to be cheated.",96,507,0.0,4c53b49843bfe12a
d_gutenberg_0015,gutenberg_poetry_corpus,28591,"Our bearings carefully where breakers roar
And fearful tempests gather: one mistake
May wreck unnumbered barks that follow in our wake.
If you have a word of cheer
That may light the pathway drear,
Of a brother pilgrim here,
Let him know.
Show him you appreciate
What he does, and do not wait
Till the heavy hand of fate
Lays him low.",62,334,0.0,5e952404b14216c4
d_gutenberg_0016,gutenberg_poetry_corpus,34870,"Below) the charms, once objects of thy love,'
Why ceased she? Ah! my captive hand why freed?
Such of her soft and hallowed tones the chain,
From that delightful heaven my soul could scarcely move.""
But, when spring returns, it brings a renewal of his grief:
""The spring returns, with all her smiling train;
The wanton Zephyrs breathe along the bowers,",62,351,0.0,d83e33df5bd07a6f
d_gutenberg_0017,gutenberg_poetry_corpus,10493,"You borrowed so frank and so free,
When the publican landed your fifty-pound cheque
At Tambo your very last spree?
Luck changes some natures, but yours, Sammy Holt,
Was a grand one as ever I see,
And I fancy I’ll whistle a good many tunes
Ere you think of that fiver or me.
Oh! don’t you remember the cattle you duffed,
And your luck at the Sandy Creek rush,
And the poker you played, and the bluffs that you bluffed,
And your habits of holding a flush?
And don’t you remember the pasting you got
By the boys down in Callaghan’s store,
When Tim Hooligan found a fifth ace in his hand,",113,584,0.0,1ab7510a71fea5b2
d_gutenberg_0018,gutenberg_poetry_corpus,34298,"Know me thus weak,--I envy while I blame;
_Thou hast been loved!_ And had I err'd like thee;
Mine had been crime, from which thy soul is free,
Thy gentler breast the traitor could forgive----""
""Never!"" cried Arden--
""_Does the Traitor live?_""
And as the ear that hissing whisper thrill'd,
That calm stern eye the very life-blood chill'd;
For there, the instinct Cain bequeath'd us spoke,
And from the chain the wild's fierce savage broke.
""O yes!"" the fiery Alien thus renew'd;",84,477,0.0,6668d0fa55750a59
d_gutenberg_0019,gutenberg_poetry_corpus,1004,"Not of repose, but even of lesser pain.
And as the cranes go chanting forth their lays,
Making in air a long line of themselves,
So saw I coming, uttering lamentations,
Shadows borne onward by the aforesaid stress.
Whereupon said I: ""Master, who are those
People, whom the black air so castigates?""
""The first of those, of whom intelligence
Thou fain wouldst have,"" then said he unto me,
""The empress was of many languages.
To sensual vices she was so abandoned,
That lustful she made licit in her law,",89,502,0.0,9472d7498b0607c6
d_gutenberg_0020,gutenberg_poetry_corpus,2199,"they saw the captain of their horsemen (the best man they had)
laid low, and I swept down on them like a whirlwind, taking fifty
spear. I should have even killed the two Moliones, sons of Actor,
hidden them in a thick mist and borne them out of the fight.
Thereon Jove vouchsafed the Pylians a great victory, for we
chased them far over the plain, killing the men and bringing in",72,379,0.0,92349f4a0970f792
d_gutenberg_0021,gutenberg_poetry_corpus,8187,"Had kist the shell, I kist it too--
How sweet, how wrong it seemed!
Oh, trust me, 'twas a place, an hour,
The worst that e'er the tempter's power
Could tangle me or you in;
Sweet Nea, let us roam no more
Along that wild and lonely shore.
Such walks may be our ruin.
You read it in these spell-bound eyes,
And there alone should love be read;
You hear me say it all in sighs,
And thus alone should love be said.
Then dread no more; I will not speak;
Although my heart to anguish thrill,",98,485,0.0,943a422c2093fa78
d_gutenberg_0022,gutenberg_poetry_corpus,58,"On the Tarpeian rock, her citadel
Impregnable; and there Mount Palatine,
The imperial palace, compass huge, and high
The structure, skill of noblest architects,
With gilded battlements, conspicuous far,
Turrets, and terraces, and glittering spires.
Many a fair edifice besides, more like
Houses of gods--so well I have disposed",50,327,0.0,2cd2dcb668b3c146
d_gutenberg_0023,gutenberg_poetry_corpus,615,"And strove and struggled yet in bloody fray.
Lurcanio's heart with vengeful hatred glows
Against Geneura; while that other knight
As well maintains the quarrel for her right.
Six knights on foot within the palisade
Stand covered with the corslet's iron case;
Beneath the Duke of Albany arrayed,
Borne on a puissant steed of noble race:
Who there, as lord high-constable obeyed,
Was keeper of the field and of the place,
And joyed Geneura's peril to espy",78,453,0.0,0fa6932820a7d390
d_gutenberg_0024,gutenberg_poetry_corpus,692,"H was a high-cultured Hound
Who could clear forty feet at a bound,
And a coon once averred
That his howl could be heard
For five miles and three-quarters around.
I was an Ibex ambitious
To dive over chasms auspicious;
He would leap down a peak
And not light for a week,
And swear that the jump was delicious.
J was a Jackass who said
He had such a bad cold in his head,",76,369,0.0,5a2fa2975ed910ac
d_gutenberg_0025,gutenberg_poetry_corpus,835,"But the Griffin was gone.  He went to the Zoo, found a tabby
He waited half an hour and then swallowed the kitten at one gulp;
tickled his digestive organs so much that they cracked his sides
and he died; and the flea and the kitten came out quite unhurt,
only a little damp.
offended had changed him into an ugly yellow man, and had sworn
that he should only regain his shape if he was eaten by a Griffin
bleached and had their tails crimped and their whiskers starched;
after.
They had the very loveliest home you can imagine, with beautiful
soft moss and grass to grow in, trees to form a cosy shelter from
sunshine and gentle breezes, the greeting of the birds, and the
musical chatter of the brook; then when their brief visit to the",139,738,0.0,73b751da418d8f7a
d_gutenberg_0026,gutenberg_poetry_corpus,136,"And shields a stranger race.
The river, on from mill to mill,
Flows past our childhood's garden still;
But ah! we children never more
Shall watch it from the water-door!
Below the yew--it still is there--
Our phantom voices haunt the air
As we were still at play,",50,263,0.0,00224f3f654e1a5e
d_gutenberg_0027,gutenberg_poetry_corpus,20586,"And sugar, nutmeg, and ginger,
With store of ale, too;
And this ye must do
To make the wassail a swinger.
Give then to the king
And queen, wassailing,
And though with ale ye be wet here,
Yet part ye from hence
As free from offence
As when ye innocent met here",52,259,0.0,482e36cafd7e1999
d_gutenberg_0028,gutenberg_poetry_corpus,29358,"So saying, amid the mirk of night he mingled and was lost.
And therewithal Æneas, feared by sudden-flitting ghost,
Snatching his body forth from sleep, stirs up his folk at need:
""Wake ye, and hurry now, O men! get to the thwarts with speed,
And bustle to unfurl the sails! here sent from heaven again
A God hath spurred us on to flight, and biddeth hew atwain
The hempen twine. O holy God, we follow on thy way,
Whatso thou art; and glad once more thy bidding we obey.
O be with us! give gracious aid; set stars the heaven about
To bless our ways!""
And from the sheath his lightning sword flew out
E'en as he spake: with naked blade he smote the hawser through,
And all are kindled at his flame; they hurry and they do.
The shore is left, with crowd of keels the sight of sea is dim;",153,784,0.0,5d7130ece8259776
d_gutenberg_0029,gutenberg_poetry_corpus,5098,"Of all this, Cowley appears to have been without knowledge, or
without care.  He makes no selection of words, nor seeks any
It seems to follow from the necessity of the subject, rather than
fortuitous:  he sinks willingly down to his general carelessness,
His contractions are often rugged and harsh:
One flings a mountain, and its rivers too
Torn up with 't.
His rhymes are very often made by pronouns, or particles, or the
like unimportant words, which disappoint the ear, and destroy the
His combination of different measures is sometimes dissonant and",93,555,0.0,e464913ab0d5472e
d_gutenberg_0030,gutenberg_poetry_corpus,37452,"From out the lattice came.
A little child with inward song,
No louder noise to dare,
Stood near the wall to see at play
The lizards green and rare--
Unblessed the while for his childish smile
Which cometh unaware.
In death-sheets lieth Rosalind
As white and still as they;",50,272,0.0,09b5b66f593b92bf
d_gutenberg_0031,gutenberg_poetry_corpus,23819,"He will besiege, and drag you forth in chains
To Aix, his royal city, there to meet
A felon's doom.""--Quivering with rage and fear,
The King Marsile, who held a gold-winged dart,
Aims it at him; but others stayed his hand.
The King Marsile turned pale, and full of wrath,",52,271,0.0,0d235d5af164f0dd
d_gutenberg_0032,gutenberg_poetry_corpus,8912,"And whirl'd and whirl'd him far away;
And in one hospitable Cleft
The little careless Broom was left
To live for many a day.
Oft I had heard of Lucy Gray,
And when I cross'd the Wild,
I chanc'd to see at break of day
The solitary Child.
No Mate, no comrade Lucy knew;
She dwelt on a wild Moor,
The sweetest Thing that ever grew
Beside a human door!
You yet may spy the Fawn at play,
The Hare upon the Green;",83,407,0.0,b1d3f8b3d85ecbb9
d_gutenberg_0033,gutenberg_poetry_corpus,34982,"See! The sun is slowly rising
O'er the level fields of grain,
Restless, golden billows surging
On a vast and boundless main.--
Hark! A distant sound is breaking
Through the stillness deep and calm--
O'er the prairies floats the cadence
Of sweet Nature's morning psalm.
We love thy rolling prairies;",50,298,0.0,d4dbf7345770227b
d_gutenberg_0034,gutenberg_poetry_corpus,1365,"From that the Student had just told;
World-wide apart, and yet akin,
As showing that the human heart
Beats on forever as of old,
As well beneath the snow-white fold
Of Quaker kerchief, as within
Sendal or silk or cloth of gold,
And without preface would begin.
And then the clamorous clock struck eight,",56,303,0.0,386b3b51104d485c
d_gutenberg_0035,gutenberg_poetry_corpus,42171,"The air is heavy with a mist of spice,
Vervain and agrimony, clove and rue,
Have I not paid, have I not paid the price?
How shall these tempters torture me anew?
I close my eyes and dream the incense drifts
Over the monstrance, and the acolyte
Swings the gold censer. Then the vision lifts:
I know the poisonous joys I have to fight.
Day with its flowers and yellow butterflies,
Holds for my heart no pain, the wind is free",81,423,0.0,c5841b6789cdb7ef
d_gutenberg_0036,gutenberg_poetry_corpus,703,"And triple Cerberus from below
Must leash'd t' himself with him a hunting go.
Now Whitehall's in the grave,
And our head is our slave,
The bright pearl in his close shell of oyster;
Now the miter is lost,
The proud Praelates, too, crost,
And all Rome's confin'd to a cloister.
He, that Tarquin was styl'd,
Our white land's exil'd,
Yea, undefil'd;
Not a court ape's left to confute us;
Then let your voyces rise high,
As your colours did flye,",81,442,0.0,30e07c1789574d1f
d_gutenberg_0037,gutenberg_poetry_corpus,6269,"Dead: and here, true to my vow,
I, who have won in the race,
Weave you a chaplet of song
Wet with the spray and the rime
Blown from your love that was strong--
Stronger than Time.",37,179,0.0,3354abb604934700
d_gutenberg_0038,gutenberg_poetry_corpus,36098,"For I know not whither you fly, nor you, where I go,
O soul that I would have loved, and _that_ you know!
When I behold thee wander by, my languorous love,
To songs of viols which throughout the dome resound,
Harmonious and stately as thy footsteps move,
Bestowing forth the languor of thy glance profound.",56,306,0.0,d277c1c372bc1fbb
d_gutenberg_0039,gutenberg_poetry_corpus,11985,"My illusions, my youth overcame,
I forgot that sweet voice full of music--
And thy glance like a heavenly flame.
In the covert and grief of my exile,
The days stretched unchanged in their flight,
Bereft inspiration or power,
Bereft both of love and of light.
To my soul now approaches awakening,
To me thou art come from above,
As a radiant and wonderful vision--
As an angel of beauty and love.
As before my heart throbs with emotion,
Life looks to me worthy and bright,
And I feel inspiration and power--",92,506,0.0,20999967ba828023
d_gutenberg_0040,gutenberg_poetry_corpus,1006,"Unearthly was the hymn, which then arose.
I understood it not, nor to the end
Endur'd the harmony.  Had I the skill
To pencil forth, how clos'd th' unpitying eyes
Slumb'ring, when Syrinx warbled, (eyes that paid
So dearly for their watching,) then like painter,
That with a model paints, I might design
The manner of my falling into sleep.
But feign who will the slumber cunningly;
I pass it by to when I wak'd, and tell
How suddenly a flash of splendour rent",84,459,0.0,fc4fa1a2a1ce20b5
d_gutenberg_0041,gutenberg_poetry_corpus,1001,"When shall approach the hostile Potentate,
Each one shall find again his dismal tomb,
Shall reassume his flesh and his own figure,
Shall hear what through eternity re-echoes.""
So we passed onward o'er the filthy mixture
Of shadows and of rain with footsteps slow,
Touching a little on the future life.
Wherefore I said: ""Master, these torments here,
Will they increase after the mighty sentence,
Or lesser be, or will they be as burning?""
And he to me: ""Return unto thy science,
Which wills, that as the thing more perfect is,",92,526,0.0,b7e6601ddb674c21
d_gutenberg_0042,gutenberg_poetry_corpus,30652,"For you, although you've not her wandering heart,
Have all that greatness, and not hers alone.
For there is no high story about queens
In any ancient book but tells of you,
And when I've heard how they grew old and died
Or fell into unhappiness I've said;
'She will grow old and die and she has wept!'
And when I'd write it out anew, the words,
Outrun the measure.
I'd tell of that great queen
Who stood amid a silence by the thorn
Until two lovers came out of the air
With bodies made out of soft fire. The one
About whose face birds wagged their fiery wings",110,559,0.0,df0403379d1fa7dd
d_gutenberg_0043,gutenberg_poetry_corpus,2863,"I left you to your adorning.""
""I'll tell--being past all praying for -
Then promptly die . . . He was out at the war,
And got some scent of the intimacy
That was under way between her and me;
And he stole back home, and appeared like a ghost
One night, at the very time almost
That I reached her house.  Well, I shot him dead,
And secretly buried him.  Nothing was said.
""The news of the battle came next day;
He was scheduled missing.  I hurried away,
Got out there, visited the field,
And sent home word that a search revealed",100,528,0.0,44997becab504238
d_gutenberg_0044,gutenberg_poetry_corpus,2507,"The winds are out with the waves at play,
And I shall not tempt the sea to-day.
""The trail is narrow, the wood is dim,
The panther clings to the arching limb;
And the lion's whelps are abroad at play,
And I shall not join in the chase to-day.""
But the ship sailed safely over the sea,
And the hunters came from the chase in glee;
And the town that was builded upon a rock
Was swallowed up in the earthquake shock.",84,413,0.0,ebb9093874e89154
d_gutenberg_0045,gutenberg_poetry_corpus,8197,"Where the white clouds lie soft as seraphs' wings,
Mine the sweet, shadowed light in innocent eyes,
Whose lovely looks light only on lovely things.
Mine the Blue Distance, delicate and clear,
Mine the Blue Glory of the morning sea,
All that the soul so longs for, finds not here,
Fond eyes deceive themselves, and find in me.
Hail! to the Royal Red of living Blood,
Let loose by steel in spirit-freeing flood,
Forced from faint forms, by toil or torture torn
Staining the patient gates of life new born.
Banners that flash, red flags that flaunt and glow,
Colour of Carnage, Glory, also Shame,
Raiment of women women may not name.",113,630,0.0,9b0c1ce18b85a51e
d_gutenberg_0046,gutenberg_poetry_corpus,41537,"Know, the Great Mantle sometime was my dress.
I of the Bear, in sooth, was worthy son:
As once, the Cubs to help, my purse with gain
I stuffed, myself I in this purse have stown.
Stretched out at length beneath my head remain
All the simoniacs that before me went,
And flattened lie throughout the rocky vein.
I in my turn shall also make descent,
Soon as he comes who I believed thou wast,
When I asked quickly what for him was meant.",84,435,0.0,8c518353554e5a87
d_gutenberg_0047,gutenberg_poetry_corpus,20956,"Watches swart arms roll down the precious bales,
Spoils of the tropic forests; year by year
Amid the din of heathen voices, groaning,
Himself half heathen? How to those--brave hearts!
Who toil with laden loins and sinking stride
Beside the bitter wells of treeless sands
Toward the peaks which flood the ancient Nile,
To free a tyrant's captives? How to those--
New patriarchs of the new-found under world--",70,407,0.0,4c2796fde3347735
d_gutenberg_0048,gutenberg_poetry_corpus,692,"one dangling leg farther out the window, supporting
his weight by the palms of his hands, and poised as
though about to spring--""what 'id you say?""
""Didn't say nothin',"" said the cross-eyed boy,
feebly; and then, as a sudden and most bewildering
smile lighted up his defective eyes, he exclaimed:
""Oh, I tell you what le's do!  Le's me and you
git up a show in your stable, and don't let none o'
the other boys be in it!  I kin turn a handspring
like you, and purt' nigh walk on my hands; and
you kin p'form on the slack-rope--and spraddle",105,539,0.0,91ea39ae6493d9ce
d_gutenberg_0049,gutenberg_poetry_corpus,2294,"But sure I know not tears nor gold can turn the years again
To little Mag o' Monagan's a-singing in the rain.
THE cretonne in your willow chair
Shows through a zone of rosy air,
A tree of parrots, agate-eyed,
With blue-green crests and plumes of pride
And beaks most formidably curved.",55,285,0.0,424e178e36e53c0e
d_gutenberg_0050,gutenberg_poetry_corpus,20,"Of future we may deem him, though till now
Omniscient thought.  True is, less firmly arm'd,
Some disadvantage we endur'd and paine,
Till now not known, but known as soon contemnd,
Since now we find this our Empyreal forme
Incapable of mortal injurie
Imperishable, and though peirc'd with wound,
Soon closing, and by native vigour heal'd.",56,337,0.0,8c4d2ab30c88fc26
d_gutenberg_0051,gutenberg_poetry_corpus,258,"With the waves subsiding and sinking,
And clots the coast herbage, shrinking,
With the hue of the white cere-cloth.
Is there aught worth losing or keeping?
The bitters or sweets men quaff?
The sowing or the doubtful reaping?
The harvest of grain or chaff?
Or squandering days or heaping,
Or waking seasons or sleeping,
The laughter that dries the weeping,
Or the weeping that drowns the laugh?
For joys wax dim and woes deaden,",75,427,0.0,cdd3495bbef281a7
d_gutenberg_0052,gutenberg_poetry_corpus,31712,"Where you sat and read; and all
The fond love that made your face
A soft sunbeam in that place:
And the plant, that grew this bloom
Withered here, itself long dead,
Makes a halo overhead
There again--and through my room,
Like faint whispers of perfume,",47,252,0.0,8027985401ee638b
